{"attestation_id":"9362c726-59fc-41fe-a700-a85329b8df87","authorization_scope":"CREATE_C2_ONLY","candidate":"v7","candidate_package":{"applied_state_sha256":"7948ae946900dc472ac319e7a0574aa15d0da93cb6ceb10e0a1f59d012f024c3","contract_sha256":"b31d93680f685ed86ed28fcb9ee819292f6cdbe4c49b8aa3a2be3db097bb06db","governing_manifest_sha256":"97d1e8bab9f32ff7bb96e2d15f2d73abb2e9f8283873c3d1b5b993112884a465"},"created_utc":"2026-07-27T15:50:58Z","governing_records":{"independent_full_diff_review_sha256":"3bce9b065454819c9ee204fd9386bbcd4db489d52b638b507227ff8d0c8918d9","procedure_freeze_record_sha256":"b2a7efe6828dcbd307dbc73fcd1ef3d86658a3299ed0e0a0bbd53a8a770bdf55","quality_gate_record_sha256":"9d67cde23cd4c8f05bfe8a94286ade8c50e24dfe58d3090f42cc71ca177092c3","write_set_v5_sha256":"0fb254adbed71aefe7197bbf29962bb3e0b44062cfdce62a1f83355e0f9476fb"},"promotion_decision":"PASS","release":"ADP-v2.4","repository":{"branch":"adp-v2.4-candidate-v7-controlled-remediation","c1_commit_sha":"12fec97f9ef858c9aae5d844973b38d0f2cd1753","c1_parent_sha":"b934c7bd84bfbc35563f3681712c4d5bd8478196","c1_tree_sha":"760a0da5f425a706b0e1e8cd3be3f0f6c0d5f6d4","origin":"git@github.com:TimSimmons3/AI-Development-Platform.git","root_identifier":"AI-Development-Platform"},"schema_version":"1.0","signer":{"algorithm":"ssh-ed25519","fingerprint":"SHA256:0qeoMO4IKy6h+1f1FX3YjBWO74wojsLoFETWp4YEy1c","namespace":"adp-v2.4-candidate-v7-promotion","principal":"timothy_simmons99@yahoo.com"},"write_set":[{"blob_sha1":"2984c1983c31c12daf04584656b22a6720bbc668","git_mode":"100644","path":"artifacts/Configuration/ADP-v2.4/counted-rag-evidence-filename-map-v7.json","sha256":"5bcd9cea8c85b14fc0d767f9298c30d570337ec2805f2d51981297733f9dd5b4"},{"blob_sha1":"b71541e1b73537aaa5bb7cbd121ff52ac7d75524","git_mode":"100644","path":"artifacts/Configuration/ADP-v2.4/counted-rag-execution-authorization-v7.schema.json","sha256":"1212312f1216eec2a94d234a8936a4cb25d16973c4c4ac9fe4e0105a5c5512bd"},{"blob_sha1":"357709b51e2fa0318e441975cd0529c5aeee1050","git_mode":"100644","path":"artifacts/Configuration/ADP-v2.4/counted-rag-execution-binding-report-v7.schema.json","sha256":"35bdef813dd0a3ddc54161bb861e50bdce863c789e5fd22f553fb5937eb70c87"},{"blob_sha1":"dfa80abb49bae8701cdf6d1a5503d6783f75e7fc","git_mode":"100644","path":"artifacts/Configuration/ADP-v2.4/counted-rag-governing-bindings-v7.json","sha256":"97d1e8bab9f32ff7bb96e2d15f2d73abb2e9f8283873c3d1b5b993112884a465"},{"blob_sha1":"45e7ff8c8118e60241ef584126a4cba9388b4123","git_mode":"100644","path":"artifacts/Configuration/ADP-v2.4/counted-rag-promotion-attestation-v7.schema.json","sha256":"d2ec5607e3bceb68dc0d225aa341cdc6257dc19cc2ba9cc92b07baea9125a0c7"},{"blob_sha1":"6d40b1230fe660a0cc7cb352a0d2278c11eba793","git_mode":"100644","path":"artifacts/Configuration/ADP-v2.4/counted-rag-promotion-binding-report-v7.schema.json","sha256":"db7dd50378336e65e7e53b6e345fc15ca24a1e3f1173cfeebbfba921ba3e9a9f"},{"blob_sha1":"43d4b3a1cd9e2f945d3cf16396783a8a3f794d89","git_mode":"100644","path":"artifacts/Configuration/ADP-v2.4/counted-rag-qualification-design-candidate-v7.json","sha256":"b31d93680f685ed86ed28fcb9ee819292f6cdbe4c49b8aa3a2be3db097bb06db"},{"blob_sha1":"41dd44f3e18db2995449b74ba175c9e7b1464856","git_mode":"100644","path":"artifacts/Configuration/ADP-v2.4/counted-rag-signer-trust-v7.json","sha256":"44ff1c016af515952564300a776dca5f231468b31608319427f4baf7d27d31eb"},{"blob_sha1":"7909d554eea11c3044bdba9308eb1521774e3893","git_mode":"100644","path":"artifacts/Test-Data/ADP-v2.4/counted-validator-v7-fixture-expectations.json","sha256":"2b65a5607d1b8458776a803d0cfc200caa59ae623d2b4653452a7a7602f28d46"},{"blob_sha1":"faafa8064817803547ec21d3c15fd59305e42813","git_mode":"100644","path":"artifacts/Test-Data/ADP-v2.4/counted-validator-v7-fixtures/case-a-citation-followed-by-text.txt","sha256":"098c6fe4f086e49b4ea76e52171fcb64e989ce7218f7498a0806e69a1263a9c0"},{"blob_sha1":"ef32433fc3c31caa5b231e2f18cd46d2fb100c33","git_mode":"100644","path":"artifacts/Test-Data/ADP-v2.4/counted-validator-v7-fixtures/case-a-duplicate-citation.txt","sha256":"e3691815298fc21ae4a5ca3dfa14cb7dc60cbcc4682a6af778b7d431beccebd8"},{"blob_sha1":"3cccd3e1d30f5dfb6f4525ba05d3ebdaf28f7420","git_mode":"100644","path":"artifacts/Test-Data/ADP-v2.4/counted-validator-v7-fixtures/case-a-exact.txt","sha256":"a9dd9077ce36f77d0a484412d59dc854452c090c052bab01b6b29471a45aea06"},{"blob_sha1":"dd4054161429f6f15cdca944b91db063eb992eb1","git_mode":"100644","path":"artifacts/Test-Data/ADP-v2.4/counted-validator-v7-fixtures/case-a-extra-commentary.txt","sha256":"060a6d2726886566486164fddfe4c8b6804567068e13ef0e0e376a669b9c3c91"},{"blob_sha1":"433337f4ab54152f59edad4c4ddbc7498d0c1a0a","git_mode":"100644","path":"artifacts/Test-Data/ADP-v2.4/counted-validator-v7-fixtures/case-a-leading-citation.txt","sha256":"6c37c55f026821567b546f1f760f6e9d829e4970cadaae5001547b7dfa02d63f"},{"blob_sha1":"50fe43a83fd0dfb354978d4aaf3e8352b14a279e","git_mode":"100644","path":"artifacts/Test-Data/ADP-v2.4/counted-validator-v7-fixtures/case-a-mixed-citations.txt","sha256":"bd735d59b55be6a3646fb6dbafb1f019f1bd073c65d0a3275c70a8bf2dc4745f"},{"blob_sha1":"c503fc27bf615fd398edd6236330519b1e2a9002","git_mode":"100644","path":"artifacts/Test-Data/ADP-v2.4/counted-validator-v7-fixtures/case-a-negated-accepted.txt","sha256":"58a6df3dd0abd977aafb011745c97892b34dbb10c20367f605d9403afef794da"},{"blob_sha1":"c7de0fa6808e2a225b5454cfed4bcbe4fbc65337","git_mode":"100644","path":"artifacts/Test-Data/ADP-v2.4/counted-validator-v7-fixtures/case-a-negated-forbidden.txt","sha256":"7e7976acb6d93a621ca75c5e6fd1d597771bf3485ac2149cd9366791d75e94b4"},{"blob_sha1":"1e2664eb26952299d44f9282e5a923f21d2d0fad","git_mode":"100644","path":"artifacts/Test-Data/ADP-v2.4/counted-validator-v7-fixtures/case-a-never-forbidden.txt","sha256":"34dfc281d6437718e63076b103e66fc3934da6f5e84b334353c64428999f399c"},{"blob_sha1":"fa6d973547ca6160e4a2ba48aae0d087d9fa9bc8","git_mode":"100644","path":"artifacts/Test-Data/ADP-v2.4/counted-validator-v7-fixtures/case-a-new-sentence-conflict.txt","sha256":"fcddf354db9264f8b0446b1dea966fe57559a5a960bc4e0628dcbc8e42b4a88d"},{"blob_sha1":"fd7fea0f009cee02e65100766c6acd3e651663a2","git_mode":"100644","path":"artifacts/Test-Data/ADP-v2.4/counted-validator-v7-fixtures/case-a-no-citation.txt","sha256":"31868450944df3ae3653a5f410fce8cd4ea234e759869a9befd54307c4793c85"},{"blob_sha1":"07d24736b4cd08dd76c635d91978ce47718390c3","git_mode":"100644","path":"artifacts/Test-Data/ADP-v2.4/counted-validator-v7-fixtures/case-a-no-longer-accepted.txt","sha256":"769c984e116d75ecce40a54be452fd5342dfad5873471fca789da8f9adb9cc78"},{"blob_sha1":"1c901a6b7fdc3a43629ea2cc7c920feb05578355","git_mode":"100644","path":"artifacts/Test-Data/ADP-v2.4/counted-validator-v7-fixtures/case-a-reversed-actual-conflict.txt","sha256":"bd42285cba5d45793887823d5870f8b4674f9b3dfac57ef1ab614010872697d6"},{"blob_sha1":"7899b70574509f0ad5f1733e23e15fd2d7f3676d","git_mode":"100644","path":"artifacts/Test-Data/ADP-v2.4/counted-validator-v7-fixtures/case-a-wrong.txt","sha256":"3b0d4594211ee4feb425560f7debd4e8b7d6ddde42a500ff819847d8efcc5599"},{"blob_sha1":"da3042c563228295efc0b0de2678462d7b4a65e1","git_mode":"100644","path":"artifacts/Test-Data/ADP-v2.4/counted-validator-v7-fixtures/case-b-actual-conflict.txt","sha256":"05354e65dd86afd172f63d7134e2ddce80e9081e20f51d8d336a4d0b5c255d18"},{"blob_sha1":"f08ee03e00fc1367008bcf70a2eef35cd46274bd","git_mode":"100644","path":"artifacts/Test-Data/ADP-v2.4/counted-validator-v7-fixtures/case-b-exact.txt","sha256":"fa924aff401f2e4b1386107a8124893d766024619894e70ee87a2ca015d4c28d"},{"blob_sha1":"d2364e7695d719de23bfb7120762ecc3d515d89c","git_mode":"100644","path":"artifacts/Test-Data/ADP-v2.4/counted-validator-v7-fixtures/case-b-negated-accepted.txt","sha256":"3cc0a7d4c22d76de3b9593e3fd826856b064ba498355d2521bae8e486af7672e"},{"blob_sha1":"a68e2f4ad2fad9c041ef3b614196e7a5806915d3","git_mode":"100644","path":"artifacts/Test-Data/ADP-v2.4/counted-validator-v7-fixtures/case-b-negated-forbidden.txt","sha256":"dad4ce029704ab87419e8dfcf035ece4ad74b8333baca74abdd53ca4b5fef6c0"},{"blob_sha1":"24db670bd4db6090acdb62da8d3212eb89f887ff","git_mode":"100644","path":"artifacts/Test-Data/ADP-v2.4/counted-validator-v7-fixtures/case-b-numeric-equivalent.txt","sha256":"ea534768b02edec9b1a2b127476ec72538d569f65f4195d494aaa7fd537e7ae8"},{"blob_sha1":"33bf7f7ad833ca4c7161ec6558a13351ca47872b","git_mode":"100644","path":"artifacts/Test-Data/ADP-v2.4/counted-validator-v7-fixtures/case-b-wrong.txt","sha256":"cd502991f0547588c31fffb25bab918d0c0834835ac1af31f8932d311e05b3ce"},{"blob_sha1":"2167c9127a138380b8e7011524604d8d3a8bd744","git_mode":"100644","path":"artifacts/Test-Data/ADP-v2.4/counted-validator-v7-fixtures/case-c-actual-window-conflict.txt","sha256":"5a124cfb72762b64c6ae5c0cdb1f869a30f31469c81cab30cd14dd92ea00a519"},{"blob_sha1":"0516e54eec48bc2f2260acaf34b21d798bef091c","git_mode":"100644","path":"artifacts/Test-Data/ADP-v2.4/counted-validator-v7-fixtures/case-c-ambiguous-pronoun-color-conflict.txt","sha256":"98d3664f389b8abdbe9e6572189612497f8adeba3841c365eb6b605b62325a7e"},{"blob_sha1":"d19d7291b09a8b938aa47ebd17d5b167835feabf","git_mode":"100644","path":"artifacts/Test-Data/ADP-v2.4/counted-validator-v7-fixtures/case-c-duplicate-claim.txt","sha256":"c710fd8c358bc66cf9339d6ddb5596456db5b838d7f4569ddb7265acccddc251"},{"blob_sha1":"e2a0426d74f4354e697a2b28a852409cf4aa1cca","git_mode":"100644","path":"artifacts/Test-Data/ADP-v2.4/counted-validator-v7-fixtures/case-c-exact.txt","sha256":"9d49c159a742ea5491a12f427810836f2a50ea4145c8602d037481301195a830"},{"blob_sha1":"e6e2ebf5f10f6bdb3b31b2cd93045e7ce1e801ab","git_mode":"100644","path":"artifacts/Test-Data/ADP-v2.4/counted-validator-v7-fixtures/case-c-extra-commentary.txt","sha256":"b07b83569e7f5def09fc3756ba0ab07ead9475225c717cbe7020ec414aae2042"},{"blob_sha1":"aa625929dec32535f1bb90cb01f21b967f53b134","git_mode":"100644","path":"artifacts/Test-Data/ADP-v2.4/counted-validator-v7